{
  "$schema": "../../bao/schemas/bao-manifest-v1.schema.json",
  "classification": {
    "channel": "public",
    "visibility": "public",
    "packageKind": "library"
  },
  "formatKind": "canonical",
  "identity": {
    "id": "bao-constants",
    "packageName": "@baohaus/bao-constants",
    "packageVersion": "0.1.0",
    "ociRepository": "baohaus/bao-constants",
    "registryNamespace": "baohaus"
  },
  "manifestEncoding": "json",
  "mediaType": "application/vnd.baohaus.bao.archive.v1+tar",
  "provenance": "SLSA.provenance.intoto.jsonl",
  "publish": {
    "gateProfile": "standard"
  },
  "dependencies": [
    {
      "name": "@baohaus/bao-schemas",
      "version": "0.1.0",
      "ociRepository": "baohaus/bao-schemas",
      "ociDigest": "sha256:03161584ac81910408852a52eec8d29c8665b0b417cf5f9e0d5e0c4f4d153dd9",
      "integrity": "sha256-AxYVhKyBkQQIhSpS7sjSnIZlsLQXz1+eDV4MT00VPdk=",
      "signature": {
        "provider": "ed25519",
        "bundle": "h1TiWBE1xMFjZ6DFAVwH0Ggv4wgEzaacY5LfhxPK4LRsOocSmEMYAibfGi3NK0YdSDbGJbhIblDHAWJs88pRDQ==",
        "keyId": "727d68a8ba3f30644216294d054d0366ee6b3db4b87b780b5f6b3002b45450ce",
        "transparencyLog": "https://rekor.sigstore.dev"
      }
    }
  ],
  "reproducibleBuild": {
    "sourceDateEpoch": 1745366400,
    "toolchain": {
      "bun": "1.3.13"
    }
  },
  "runtime": {
    "installable": true,
    "composeDependencies": []
  },
  "sbom": "SBOM.cdx.json",
  "schemaVersion": 1,
  "specRevision": "1.0.0"
}
