{
  "$schema": "../../bao/schemas/bao-manifest-v1.schema.json",
  "schemaVersion": 1,
  "specRevision": "1.0.0",
  "mediaType": "application/vnd.baohaus.bao.archive.v1+tar",
  "formatKind": "canonical",
  "manifestEncoding": "json",
  "identity": {
    "id": "baohaus-design-tokens-aurora-bao",
    "packageName": "@baohaus/baohaus-design-tokens-aurora-bao",
    "packageVersion": "0.1.0",
    "ociRepository": "baohaus/baohaus-design-tokens-aurora-bao",
    "registryNamespace": "baohaus"
  },
  "classification": {
    "channel": "public",
    "visibility": "public",
    "packageKind": "extension"
  },
  "runtime": {
    "installable": true,
    "composeDependencies": []
  },
  "publish": {
    "gateProfile": "standard"
  },
  "targets": [
    {
      "kind": "design-tokens",
      "target": "baohaus-aurora-tokens",
      "tokenSetId": "baohaus-aurora",
      "categories": ["spacing", "radius", "shadow", "typography"],
      "stylesheet": "assets/baohaus-aurora-tokens.css"
    }
  ],
  "dependencies": [],
  "sbom": "SBOM.cdx.json",
  "provenance": "SLSA.provenance.intoto.jsonl",
  "reproducibleBuild": {
    "sourceDateEpoch": 1745366400,
    "toolchain": {
      "bun": "1.3.13"
    }
  }
}
