{
  "$schema": "../../bao/schemas/bao-manifest-v1.schema.json",
  "schemaVersion": 1,
  "specRevision": "1.0.0",
  "mediaType": "application/vnd.baohaus.bao.archive.v1+tar",
  "formatKind": "canonical",
  "manifestEncoding": "json",
  "identity": {
    "id": "baohaus-density-preset-aurora-bao",
    "packageName": "@baohaus/baohaus-density-preset-aurora-bao",
    "packageVersion": "0.1.0",
    "ociRepository": "baohaus/baohaus-density-preset-aurora-bao",
    "registryNamespace": "baohaus"
  },
  "classification": {
    "channel": "public",
    "visibility": "public",
    "packageKind": "extension"
  },
  "runtime": {
    "installable": true,
    "composeDependencies": []
  },
  "publish": {
    "gateProfile": "standard"
  },
  "targets": [
    {
      "kind": "density-preset",
      "target": "baohaus-aurora-density",
      "presetId": "baohaus-aurora",
      "density": "comfortable",
      "stylesheet": "assets/baohaus-aurora-density.css"
    }
  ],
  "dependencies": [],
  "sbom": "SBOM.cdx.json",
  "provenance": "SLSA.provenance.intoto.jsonl",
  "reproducibleBuild": {
    "sourceDateEpoch": 1745366400,
    "toolchain": {
      "bun": "1.3.13"
    }
  }
}
