{
  "$schema": "../../bao/schemas/bao-manifest-v1.schema.json",
  "schemaVersion": 1,
  "specRevision": "1.0.0",
  "mediaType": "application/vnd.baohaus.bao.archive.v1+tar",
  "formatKind": "canonical",
  "manifestEncoding": "json",
  "identity": {
    "id": "ecosystem-events-bao",
    "packageName": "@baohaus/ecosystem-events-bao",
    "packageVersion": "0.1.0",
    "ociRepository": "baohaus/ecosystem-events-bao",
    "registryNamespace": "baohaus"
  },
  "classification": {
    "channel": "public",
    "visibility": "public",
    "packageKind": "library"
  },
  "runtime": {
    "installable": true,
    "composeDependencies": []
  },
  "publish": {
    "gateProfile": "standard"
  },
  "dependencies": [
    {
      "name": "@baohaus/bao-utils",
      "version": "0.1.0",
      "ociRepository": "baohaus/bao-utils",
      "ociDigest": "sha256:5b2f700ad984767844b08c187a28ee03406f5547270cd402ba4da73b0d112cdd",
      "integrity": "sha256-Wy9wCtmEdnhEsIwYeijuA0BvVUcnDNQCuk2nOw0RLN0=",
      "signature": {
        "provider": "ed25519",
        "bundle": "K8emMb9dOseQbdrj0ydRtrQ69oe9GAkpW4snl6NRyrXzbe8NQV/Ff0U4SbVYVDAYJwInnA8CTsri2qXsp3ZGBQ==",
        "keyId": "727d68a8ba3f30644216294d054d0366ee6b3db4b87b780b5f6b3002b45450ce",
        "transparencyLog": "https://rekor.sigstore.dev"
      }
    }
  ],
  "provenance": "SLSA.provenance.intoto.jsonl",
  "sbom": "SBOM.cdx.json",
  "reproducibleBuild": {
    "sourceDateEpoch": 1747252800,
    "toolchain": {
      "bun": "1.3.13"
    }
  }
}
