{
  "$schema": "../../bao/schemas/bao-manifest-v1.schema.json",
  "schemaVersion": 1,
  "specRevision": "1.0.0",
  "mediaType": "application/vnd.baohaus.bao.archive.v1+tar",
  "formatKind": "canonical",
  "manifestEncoding": "json",
  "identity": {
    "id": "dayjs-bao",
    "packageName": "@baohaus/dayjs-bao",
    "packageVersion": "0.1.0",
    "ociRepository": "baohaus/dayjs-bao",
    "registryNamespace": "baohaus"
  },
  "classification": {
    "channel": "public",
    "visibility": "public",
    "packageKind": "library"
  },
  "runtime": {
    "installable": true,
    "composeDependencies": []
  },
  "publish": {
    "gateProfile": "standard"
  },
  "dependencies": [],
  "sbom": "SBOM.cdx.json",
  "provenance": "SLSA.provenance.intoto.jsonl",
  "reproducibleBuild": {
    "sourceDateEpoch": 1777725555,
    "toolchain": {
      "bun": "1.3.13"
    }
  }
}
