{
  "$schema": "../../bao/schemas/bao-manifest-v1.schema.json",
  "schemaVersion": 1,
  "specRevision": "1.0.0",
  "mediaType": "application/vnd.baohaus.bao.archive.v1+tar",
  "formatKind": "canonical",
  "manifestEncoding": "json",
  "identity": {
    "id": "bao-utils",
    "packageName": "@baohaus/bao-utils",
    "packageVersion": "0.1.0",
    "ociRepository": "baohaus/bao-utils",
    "registryNamespace": "baohaus"
  },
  "classification": {
    "channel": "public",
    "visibility": "public",
    "packageKind": "library"
  },
  "runtime": {
    "installable": true,
    "composeDependencies": []
  },
  "publish": {
    "gateProfile": "standard"
  },
  "dependencies": [
    {
      "name": "@baohaus/bao-config",
      "version": "0.1.0",
      "ociRepository": "baohaus/bao-config",
      "ociDigest": "sha256:4717308fcbf6e5814f49d68bdf2fa8d33ab525465fcb53a72312ace695d9722a",
      "integrity": "sha256-Rxcwj8v25YFPSdaL3y+o0zq1JUZfy1OnIxKs5pXZcio=",
      "signature": {
        "provider": "ed25519",
        "bundle": "roQW1DyP7btSNuFPmive2ZK4aQNsFqaXScEb6nYeX0oFzjODgQAblPSn55GF0rDuZPqkuKxLx8LWBZDkRURgBA==",
        "keyId": "727d68a8ba3f30644216294d054d0366ee6b3db4b87b780b5f6b3002b45450ce",
        "transparencyLog": "https://rekor.sigstore.dev"
      }
    },
    {
      "name": "@baohaus/bao-constants",
      "version": "0.1.0",
      "ociRepository": "baohaus/bao-constants",
      "ociDigest": "sha256:b76e64434747c67ccbbb1ec431fa8f6ff39d6b6295e158fce252de27358eb14c",
      "integrity": "sha256-t25kQ0dHxnzLux7EMfqPb/Oda2KV4Vj84lLeJzWOsUw=",
      "signature": {
        "provider": "ed25519",
        "bundle": "YpPtuR1A92/93WjEq2qcwrbdl/kwOrWQquU8T/sgsgE36k2ihZcxYqYz9h+e3zKtR8m45hhtOkNgrrZGTmw8Bw==",
        "keyId": "727d68a8ba3f30644216294d054d0366ee6b3db4b87b780b5f6b3002b45450ce",
        "transparencyLog": "https://rekor.sigstore.dev"
      }
    },
    {
      "name": "@baohaus/bao-contracts",
      "version": "0.1.0",
      "ociRepository": "baohaus/bao-contracts",
      "ociDigest": "sha256:e522b2902f5fc9aaf69f078b4b9a3edf2d77a1bccd78fec2326782a963712f9f",
      "integrity": "sha256-5SKykC9fyar2nweLS5o+3y13obzNeP7CMmeCqWNxL58=",
      "signature": {
        "provider": "ed25519",
        "bundle": "UmZxAdPczt3mYccXtkYgn6IDhyT3WyCMSxldKxaI9fA/zIR6qfRxGb9eh508NO7vvOPLkay9n+M+DuOxTnzoAg==",
        "keyId": "727d68a8ba3f30644216294d054d0366ee6b3db4b87b780b5f6b3002b45450ce",
        "transparencyLog": "https://rekor.sigstore.dev"
      }
    },
    {
      "name": "@baohaus/bao-schemas",
      "version": "0.1.0",
      "ociRepository": "baohaus/bao-schemas",
      "ociDigest": "sha256:03161584ac81910408852a52eec8d29c8665b0b417cf5f9e0d5e0c4f4d153dd9",
      "integrity": "sha256-AxYVhKyBkQQIhSpS7sjSnIZlsLQXz1+eDV4MT00VPdk=",
      "signature": {
        "provider": "ed25519",
        "bundle": "h1TiWBE1xMFjZ6DFAVwH0Ggv4wgEzaacY5LfhxPK4LRsOocSmEMYAibfGi3NK0YdSDbGJbhIblDHAWJs88pRDQ==",
        "keyId": "727d68a8ba3f30644216294d054d0366ee6b3db4b87b780b5f6b3002b45450ce",
        "transparencyLog": "https://rekor.sigstore.dev"
      }
    },
    {
      "name": "@baohaus/bao-sdk",
      "version": "0.1.0",
      "ociRepository": "baohaus/bao-sdk",
      "ociDigest": "sha256:4666e676b6139ef30adf05e025bcf9063a50dd93b0386ecdf8b7298222768c1f",
      "integrity": "sha256-RmbmdrYTnvMK3wXgJbz5BjpQ3ZOwOG7N+LcpgiJ2jB8=",
      "signature": {
        "provider": "ed25519",
        "bundle": "arD5ADGixA95Dr/IP2prxPc9VCsDkJsOCRfuP80Ya9GbBtkMTJrFPjiTyjXx3iGlHsGYoh+ntQ8nayL/Hk/6BA==",
        "keyId": "727d68a8ba3f30644216294d054d0366ee6b3db4b87b780b5f6b3002b45450ce",
        "transparencyLog": "https://rekor.sigstore.dev"
      }
    },
    {
      "name": "@baohaus/bao-types",
      "version": "0.1.0",
      "ociRepository": "baohaus/bao-types",
      "ociDigest": "sha256:25eefeafebc5bc407bcfa71fa263d3fe2f605ef311502871a33caa2cfd73caf0",
      "integrity": "sha256-Je7+r+vFvEB7z6cfomPT/i9gXvMRUChxozyqLP1zyvA=",
      "signature": {
        "provider": "ed25519",
        "bundle": "f1L7pyPxI0iP02syd5LhQ6mpiWsvmNRty9Y8cjgnuoCObkhGX/DnsE+fTbHPygPYfqxv1FJPZCl/Qa1lKo42Aw==",
        "keyId": "727d68a8ba3f30644216294d054d0366ee6b3db4b87b780b5f6b3002b45450ce",
        "transparencyLog": "https://rekor.sigstore.dev"
      }
    },
    {
      "name": "@baohaus/bao-wrapture",
      "version": "0.1.0",
      "ociRepository": "baohaus/bao-wrapture",
      "ociDigest": "sha256:77761b24bc9b055186742e6be56843eca5cb5bdc57d53cc0dbd47f846f2acf95",
      "integrity": "sha256-d3YbJLybBVGGdC5r5WhD7KXLW9xX1TzA29R/hG8qz5U=",
      "signature": {
        "provider": "ed25519",
        "bundle": "SlAvttAJ9EyKIkNI21eNvAZeYUs+uHPCESM5+Yzu/jmlfypR3lae8ISeC4Evqfqlwqk/45ylb5qVR3QmtbrrBQ==",
        "keyId": "727d68a8ba3f30644216294d054d0366ee6b3db4b87b780b5f6b3002b45450ce",
        "transparencyLog": "https://rekor.sigstore.dev"
      }
    },
    {
      "name": "@baohaus/baobox",
      "version": "0.1.1",
      "ociRepository": "baohaus/baobox",
      "ociDigest": "sha256:c88470eacfeb3cfb601f05772c99e37bbf4728e9e2b5ba22aa023d7f25e0ecbd",
      "integrity": "sha256-yIRw6s/rPPtgHwV3LJnje79HKOnitboiqgI9fyXg7L0=",
      "signature": {
        "provider": "ed25519",
        "bundle": "3tFN3nc+wExvKuGMIGcoadCdKFNadU76jLqXuUFsubPrWu9+3GrhtHazynGSIYUKcFq+jhBjUvYoSy+HeBf0BQ==",
        "keyId": "727d68a8ba3f30644216294d054d0366ee6b3db4b87b780b5f6b3002b45450ce",
        "transparencyLog": "https://rekor.sigstore.dev"
      }
    },
    {
      "name": "@baohaus/baobox",
      "version": "0.1.1",
      "ociRepository": "baohaus/baobox",
      "ociDigest": "sha256:3a1979cd9dfbe10981d575665c6aff40f462c529c4c91a8fc70a31b0906305d1",
      "integrity": "sha256-Ohl5zZ374QmB1XVmXGr/QPRixSnEyRqPxwoxsJBjBdE=",
      "signature": {
        "provider": "ed25519",
        "bundle": "hy8vtyASP5/8cwG1L/P5CpvlqeH0yIll2GZqfddcdyCYmaxsx0RUrr8euHMuikqXMCRJKmGj49E22RgPzkoCAw==",
        "keyId": "727d68a8ba3f30644216294d054d0366ee6b3db4b87b780b5f6b3002b45450ce",
        "transparencyLog": "https://rekor.sigstore.dev"
      }
    },
    {
      "name": "@baohaus/dayjs-bao",
      "version": "0.1.0",
      "ociRepository": "baohaus/dayjs-bao",
      "ociDigest": null,
      "integrity": null,
      "signature": null
    },
    {
      "name": "@baohaus/sanitize-bao",
      "version": "0.1.0",
      "ociRepository": "baohaus/sanitize-bao",
      "ociDigest": null,
      "integrity": null,
      "signature": null
    }
  ],
  "sbom": "SBOM.cdx.json",
  "provenance": "SLSA.provenance.intoto.jsonl",
  "reproducibleBuild": {
    "sourceDateEpoch": 1745366400,
    "toolchain": {
      "bun": "1.3.13"
    }
  }
}
