{
  "$schema": "../../bao/schemas/bao-manifest-v1.schema.json",
  "classification": {
    "channel": "public",
    "visibility": "public",
    "packageKind": "library"
  },
  "formatKind": "canonical",
  "identity": {
    "id": "bao-config",
    "packageName": "@baohaus/bao-config",
    "packageVersion": "0.1.0",
    "ociRepository": "baohaus/bao-config",
    "registryNamespace": "baohaus"
  },
  "manifestEncoding": "json",
  "mediaType": "application/vnd.baohaus.bao.archive.v1+tar",
  "provenance": "SLSA.provenance.intoto.jsonl",
  "publish": {
    "gateProfile": "standard"
  },
  "dependencies": [
    {
      "name": "@baohaus/bao-constants",
      "version": "0.1.0",
      "ociRepository": "baohaus/bao-constants",
      "ociDigest": "sha256:b76e64434747c67ccbbb1ec431fa8f6ff39d6b6295e158fce252de27358eb14c",
      "integrity": "sha256-t25kQ0dHxnzLux7EMfqPb/Oda2KV4Vj84lLeJzWOsUw=",
      "signature": {
        "provider": "ed25519",
        "bundle": "YpPtuR1A92/93WjEq2qcwrbdl/kwOrWQquU8T/sgsgE36k2ihZcxYqYz9h+e3zKtR8m45hhtOkNgrrZGTmw8Bw==",
        "keyId": "727d68a8ba3f30644216294d054d0366ee6b3db4b87b780b5f6b3002b45450ce",
        "transparencyLog": "https://rekor.sigstore.dev"
      }
    },
    {
      "name": "@baohaus/bao-schemas",
      "version": "0.1.0",
      "ociRepository": "baohaus/bao-schemas",
      "ociDigest": "sha256:03161584ac81910408852a52eec8d29c8665b0b417cf5f9e0d5e0c4f4d153dd9",
      "integrity": "sha256-AxYVhKyBkQQIhSpS7sjSnIZlsLQXz1+eDV4MT00VPdk=",
      "signature": {
        "provider": "ed25519",
        "bundle": "h1TiWBE1xMFjZ6DFAVwH0Ggv4wgEzaacY5LfhxPK4LRsOocSmEMYAibfGi3NK0YdSDbGJbhIblDHAWJs88pRDQ==",
        "keyId": "727d68a8ba3f30644216294d054d0366ee6b3db4b87b780b5f6b3002b45450ce",
        "transparencyLog": "https://rekor.sigstore.dev"
      }
    },
    {
      "name": "@baohaus/bao-types",
      "version": "0.1.0",
      "ociRepository": "baohaus/bao-types",
      "ociDigest": "sha256:25eefeafebc5bc407bcfa71fa263d3fe2f605ef311502871a33caa2cfd73caf0",
      "integrity": "sha256-Je7+r+vFvEB7z6cfomPT/i9gXvMRUChxozyqLP1zyvA=",
      "signature": {
        "provider": "ed25519",
        "bundle": "f1L7pyPxI0iP02syd5LhQ6mpiWsvmNRty9Y8cjgnuoCObkhGX/DnsE+fTbHPygPYfqxv1FJPZCl/Qa1lKo42Aw==",
        "keyId": "727d68a8ba3f30644216294d054d0366ee6b3db4b87b780b5f6b3002b45450ce",
        "transparencyLog": "https://rekor.sigstore.dev"
      }
    },
    {
      "name": "@baohaus/bao-utils",
      "version": "0.1.0",
      "ociRepository": "baohaus/bao-utils",
      "ociDigest": "sha256:5b2f700ad984767844b08c187a28ee03406f5547270cd402ba4da73b0d112cdd",
      "integrity": "sha256-Wy9wCtmEdnhEsIwYeijuA0BvVUcnDNQCuk2nOw0RLN0=",
      "signature": {
        "provider": "ed25519",
        "bundle": "K8emMb9dOseQbdrj0ydRtrQ69oe9GAkpW4snl6NRyrXzbe8NQV/Ff0U4SbVYVDAYJwInnA8CTsri2qXsp3ZGBQ==",
        "keyId": "727d68a8ba3f30644216294d054d0366ee6b3db4b87b780b5f6b3002b45450ce",
        "transparencyLog": "https://rekor.sigstore.dev"
      }
    }
  ],
  "reproducibleBuild": {
    "sourceDateEpoch": 1745366400,
    "toolchain": {
      "bun": "1.3.13"
    }
  },
  "runtime": {
    "installable": true,
    "composeDependencies": []
  },
  "sbom": "SBOM.cdx.json",
  "schemaVersion": 1,
  "specRevision": "1.0.0"
}
