{
  "$schema": "../../bao/schemas/bao-manifest-v1.schema.json",
  "classification": {
    "channel": "public",
    "visibility": "public",
    "packageKind": "library"
  },
  "formatKind": "canonical",
  "identity": {
    "id": "bao-wrapture",
    "packageName": "@baohaus/bao-wrapture",
    "packageVersion": "0.1.0",
    "ociRepository": "baohaus/bao-wrapture",
    "registryNamespace": "baohaus"
  },
  "manifestEncoding": "json",
  "mediaType": "application/vnd.baohaus.bao.archive.v1+tar",
  "provenance": "SLSA.provenance.intoto.jsonl",
  "publish": {
    "gateProfile": "standard"
  },
  "dependencies": [
    {
      "name": "@baohaus/bao-config",
      "version": "0.1.0",
      "ociRepository": "baohaus/bao-config",
      "ociDigest": "sha256:4717308fcbf6e5814f49d68bdf2fa8d33ab525465fcb53a72312ace695d9722a",
      "integrity": "sha256-Rxcwj8v25YFPSdaL3y+o0zq1JUZfy1OnIxKs5pXZcio=",
      "signature": {
        "provider": "ed25519",
        "bundle": "roQW1DyP7btSNuFPmive2ZK4aQNsFqaXScEb6nYeX0oFzjODgQAblPSn55GF0rDuZPqkuKxLx8LWBZDkRURgBA==",
        "keyId": "727d68a8ba3f30644216294d054d0366ee6b3db4b87b780b5f6b3002b45450ce",
        "transparencyLog": "https://rekor.sigstore.dev"
      }
    },
    {
      "name": "@baohaus/bao-core",
      "version": "0.1.0",
      "ociRepository": "baohaus/bao-core",
      "ociDigest": "sha256:908fb1304a0e46883338cac4798d299c2935134af7904ec5425bd334befb3373",
      "integrity": "sha256-kI+xMEoORogzOMrEeY0pnCk1E0r3kE7FQlvTNL77M3M=",
      "signature": {
        "provider": "ed25519",
        "bundle": "4lRfm0/Gdp6/edFg0QrQlxpY6/bdCezHO/4cC3THZyU6FOyplhXHpqDrOYhzmZIax5NLvUa9Y9P2FfHdMEVECg==",
        "keyId": "727d68a8ba3f30644216294d054d0366ee6b3db4b87b780b5f6b3002b45450ce",
        "transparencyLog": "https://rekor.sigstore.dev"
      }
    },
    {
      "name": "@baohaus/bao-schemas",
      "version": "0.1.0",
      "ociRepository": "baohaus/bao-schemas",
      "ociDigest": "sha256:03161584ac81910408852a52eec8d29c8665b0b417cf5f9e0d5e0c4f4d153dd9",
      "integrity": "sha256-AxYVhKyBkQQIhSpS7sjSnIZlsLQXz1+eDV4MT00VPdk=",
      "signature": {
        "provider": "ed25519",
        "bundle": "h1TiWBE1xMFjZ6DFAVwH0Ggv4wgEzaacY5LfhxPK4LRsOocSmEMYAibfGi3NK0YdSDbGJbhIblDHAWJs88pRDQ==",
        "keyId": "727d68a8ba3f30644216294d054d0366ee6b3db4b87b780b5f6b3002b45450ce",
        "transparencyLog": "https://rekor.sigstore.dev"
      }
    },
    {
      "name": "@baohaus/bao-utils",
      "version": "0.1.0",
      "ociRepository": "baohaus/bao-utils",
      "ociDigest": "sha256:5b2f700ad984767844b08c187a28ee03406f5547270cd402ba4da73b0d112cdd",
      "integrity": "sha256-Wy9wCtmEdnhEsIwYeijuA0BvVUcnDNQCuk2nOw0RLN0=",
      "signature": {
        "provider": "ed25519",
        "bundle": "K8emMb9dOseQbdrj0ydRtrQ69oe9GAkpW4snl6NRyrXzbe8NQV/Ff0U4SbVYVDAYJwInnA8CTsri2qXsp3ZGBQ==",
        "keyId": "727d68a8ba3f30644216294d054d0366ee6b3db4b87b780b5f6b3002b45450ce",
        "transparencyLog": "https://rekor.sigstore.dev"
      }
    }
  ],
  "reproducibleBuild": {
    "sourceDateEpoch": 1745366400,
    "toolchain": {
      "bun": "1.3.13"
    }
  },
  "runtime": {
    "installable": true,
    "composeDependencies": []
  },
  "sbom": "SBOM.cdx.json",
  "schemaVersion": 1,
  "specRevision": "1.0.0"
}
